question,answer
Chỉ tiêu của Ngành Kỹ thuật Điều khiển và Tự động hoá năm 2024 là bao nhiêu?,"Bạn muốn hỏi chỉ tiêu dựa trên phương thức xét tuyển nào, cơ sở miền bắc hay nam? Ví dụ về phương thức xét tuyển như xét tuyển kết hợp, xét tuyển tài năng, thi thpt, đánh giá năng lực, đánh giá tư duy."
Chỉ tiêu của Ngành Kỹ thuật Điều khiển và Tự động hoá năm 2024 tại cơ sở miền nam theo phương thức kết quả thi thpt là bao nhiêu?,Chỉ tiêu của Ngành Kỹ thuật Điều khiển và Tự động hoá năm 2024 tại cơ sở miền nam theo phương thức kết quả thi thpt là: 40
Chỉ tiêu của Ngành Kỹ thuật Điều khiển và Tự động hoá năm 2024 tại cơ sở miền nam theo phương thức xét tuyển kết hợp là bao nhiêu?,Chỉ tiêu của Ngành Kỹ thuật Điều khiển và Tự động hoá năm 2024 tại cơ sở miền nam theo phương thức xét tuyển kết hợp là: 20
Chỉ tiêu của Ngành Kỹ thuật Điều khiển và Tự động hoá năm 2024 tại cơ sở miền nam theo phương thức xét tuyển tài năng là bao nhiêu?,Chỉ tiêu của Ngành Kỹ thuật Điều khiển và Tự động hoá năm 2024 tại cơ sở miền nam theo phương thức xét tuyển tài năng là: 10
Chỉ tiêu của Ngành Kỹ thuật Điều khiển và Tự động hoá năm 2024 tại cơ sở miền nam theo phương thức thi đánh giá năng lực là bao nhiêu?,Chỉ tiêu của Ngành Kỹ thuật Điều khiển và Tự động hoá năm 2024 tại cơ sở miền nam theo phương thức thi đánh giá năng lực là: 15
Chỉ tiêu của Ngành Kỹ thuật Điều khiển và Tự động hoá năm 2024 tại cơ sở miền nam theo phương thức thi đánh giá tư duy là bao nhiêu?,Chỉ tiêu của Ngành Kỹ thuật Điều khiển và Tự động hoá năm 2024 tại cơ sở miền nam theo phương thức thi đánh giá tư duy là: 15
Chỉ tiêu của Ngành Công nghệ Internet vạn vật (IoT) năm 2024 là bao nhiêu?,"Bạn muốn hỏi chỉ tiêu dựa trên phương thức xét tuyển nào, cơ sở miền bắc hay nam? Ví dụ về phương thức xét tuyển như xét tuyển kết hợp, xét tuyển tài năng, thi thpt, đánh giá năng lực, đánh giá tư duy."
Chỉ tiêu của Ngành Công nghệ Internet vạn vật (IoT) năm 2024 tại cơ sở miền nam theo phương thức kết quả thi thpt là bao nhiêu?,Chỉ tiêu của Ngành Công nghệ Internet vạn vật (IoT) năm 2024 tại cơ sở miền nam theo phương thức kết quả thi thpt là: 40
Chỉ tiêu của Ngành Công nghệ Internet vạn vật (IoT) năm 2024 tại cơ sở miền nam theo phương thức xét tuyển kết hợp là bao nhiêu?,Chỉ tiêu của Ngành Công nghệ Internet vạn vật (IoT) năm 2024 tại cơ sở miền nam theo phương thức xét tuyển kết hợp là: 20
Chỉ tiêu của Ngành Công nghệ Internet vạn vật (IoT) năm 2024 tại cơ sở miền nam theo phương thức xét tuyển tài năng là bao nhiêu?,Chỉ tiêu của Ngành Công nghệ Internet vạn vật (IoT) năm 2024 tại cơ sở miền nam theo phương thức xét tuyển tài năng là: 10
Chỉ tiêu của Ngành Công nghệ Internet vạn vật (IoT) năm 2024 tại cơ sở miền nam theo phương thức thi đánh giá năng lực là bao nhiêu?,Chỉ tiêu của Ngành Công nghệ Internet vạn vật (IoT) năm 2024 tại cơ sở miền nam theo phương thức thi đánh giá năng lực là: 15
Chỉ tiêu của Ngành Công nghệ Internet vạn vật (IoT) năm 2024 tại cơ sở miền nam theo phương thức thi đánh giá tư duy là bao nhiêu?,Chỉ tiêu của Ngành Công nghệ Internet vạn vật (IoT) năm 2024 tại cơ sở miền nam theo phương thức thi đánh giá tư duy là: 15
Chỉ tiêu của Công nghệ thông tin (chất lượng cao) năm 2024 là bao nhiêu?,"Bạn muốn hỏi chỉ tiêu dựa trên phương thức xét tuyển nào, cơ sở miền bắc hay nam? Ví dụ về phương thức xét tuyển như xét tuyển kết hợp, xét tuyển tài năng, thi thpt, đánh giá năng lực, đánh giá tư duy."
Chỉ tiêu của Công nghệ thông tin (chất lượng cao) năm 2024 tại cơ sở miền nam theo phương thức kết quả thi thpt là bao nhiêu?,Chỉ tiêu của Công nghệ thông tin (chất lượng cao) năm 2024 tại cơ sở miền nam theo phương thức kết quả thi thpt là: 50
Chỉ tiêu của Công nghệ thông tin (chất lượng cao) năm 2024 tại cơ sở miền nam theo phương thức xét tuyển kết hợp là bao nhiêu?,Chỉ tiêu của Công nghệ thông tin (chất lượng cao) năm 2024 tại cơ sở miền nam theo phương thức xét tuyển kết hợp là: 25
Chỉ tiêu của Công nghệ thông tin (chất lượng cao) năm 2024 tại cơ sở miền nam theo phương thức xét tuyển tài năng là bao nhiêu?,Chỉ tiêu của Công nghệ thông tin (chất lượng cao) năm 2024 tại cơ sở miền nam theo phương thức xét tuyển tài năng là: 10
Chỉ tiêu của Công nghệ thông tin (chất lượng cao) năm 2024 tại cơ sở miền nam theo phương thức thi đánh giá năng lực là bao nhiêu?,Chỉ tiêu của Công nghệ thông tin (chất lượng cao) năm 2024 tại cơ sở miền nam theo phương thức thi đánh giá năng lực là: 15
Chỉ tiêu của Công nghệ thông tin (chất lượng cao) năm 2024 tại cơ sở miền nam theo phương thức thi đánh giá tư duy là bao nhiêu?,Chỉ tiêu của Công nghệ thông tin (chất lượng cao) năm 2024 tại cơ sở miền nam theo phương thức thi đánh giá tư duy là: 15
Chỉ tiêu của Marketing chất lượng cao năm 2024 là bao nhiêu?,"Bạn muốn hỏi chỉ tiêu dựa trên phương thức xét tuyển nào, cơ sở miền bắc hay nam? Ví dụ về phương thức xét tuyển như xét tuyển kết hợp, xét tuyển tài năng, thi thpt, đánh giá năng lực, đánh giá tư duy."
Chỉ tiêu của Marketing chất lượng cao năm 2024 tại cơ sở miền nam theo phương thức kết quả thi thpt là bao nhiêu?,Chỉ tiêu của Marketing chất lượng cao năm 2024 tại cơ sở miền nam theo phương thức kết quả thi thpt là: 20
Chỉ tiêu của Marketing chất lượng cao năm 2024 tại cơ sở miền nam theo phương thức xét tuyển kết hợp là bao nhiêu?,Chỉ tiêu của Marketing chất lượng cao năm 2024 tại cơ sở miền nam theo phương thức xét tuyển kết hợp là: 10
Chỉ tiêu của Marketing chất lượng cao năm 2024 tại cơ sở miền nam theo phương thức xét tuyển tài năng là bao nhiêu?,Chỉ tiêu của Marketing chất lượng cao năm 2024 tại cơ sở miền nam theo phương thức xét tuyển tài năng là: 5
Chỉ tiêu của Marketing chất lượng cao năm 2024 tại cơ sở miền nam theo phương thức thi đánh giá năng lực là bao nhiêu?,Chỉ tiêu của Marketing chất lượng cao năm 2024 tại cơ sở miền nam theo phương thức thi đánh giá năng lực là: 5
Chỉ tiêu của Marketing chất lượng cao năm 2024 tại cơ sở miền nam theo phương thức thi đánh giá tư duy là bao nhiêu?,Chỉ tiêu của Marketing chất lượng cao năm 2024 tại cơ sở miền nam theo phương thức thi đánh giá tư duy là: 5
Học viện đào tạo những ngành nào ở cơ sở miền nam năm 2024?,"Miền nam Học Viện hiện tại đào tạo các ngành như:
Ngành Công nghệ thông tin
Ngành An toàn thông tin
Ngành Công nghệ kỹ thuật Điện điện tử
Ngành Kỹ thuật Điện tử viễn thông
Ngành Công nghệ đa phương tiện
Ngành Marketing
Ngành Quản trị kinh doanh
Ngành Kế toán
Ngành Kỹ thuật Điều khiển và Tự động hoá
Ngành Công nghệ Internet vạn vật (IoT)
Công nghệ thông tin (chất lượng cao)
Marketing chất lượng cao"
Mã ngành của Chương trình Công nghệ thông tin (định hướng ứng dụng) là bao nhiêu?,Chương trình Công nghệ thông tin (định hướng ứng dụng) có mã ngành là: 7480201_UDU
Mã ngành của Ngành Khoa học máy tính là bao nhiêu?,Ngành Khoa học máy tính có mã ngành là: 7480101
Mã ngành của Ngành Công nghệ thông tin là bao nhiêu?,Ngành Công nghệ thông tin có mã ngành là: 7480201
Mã ngành của Ngành An toàn thông tin là bao nhiêu?,Ngành An toàn thông tin có mã ngành là: 7480202
Mã ngành của Ngành Kỹ thuật Điện tử viễn thông là bao nhiêu?,Ngành Kỹ thuật Điện tử viễn thông có mã ngành là: 7520207
"Mã ngành của Ngành Công nghệ kỹ thuật Điện, điện tử là bao nhiêu?","Ngành Công nghệ kỹ thuật Điện, điện tử có mã ngành là: 7510301"
Mã ngành của Ngành Công nghệ đa phương tiện là bao nhiêu?,Ngành Công nghệ đa phương tiện có mã ngành là: 7329001
Mã ngành của Ngành Truyền thông đa phương tiện là bao nhiêu?,Ngành Truyền thông đa phương tiện có mã ngành là: 7320104
Mã ngành của Ngành Marketing là bao nhiêu?,Ngành Marketing có mã ngành là: 7340115
Mã ngành của Ngành Thương mại điện tử là bao nhiêu?,Ngành Thương mại điện tử có mã ngành là: 7340122
Mã ngành của Ngành Quản trị kinh doanh là bao nhiêu?,Ngành Quản trị kinh doanh có mã ngành là: 7340101
Mã ngành của Ngành Kế toán là bao nhiêu?,Ngành Kế toán có mã ngành là: 7340301
Mã ngành của Ngành Kế toán là bao nhiêu?,Ngành Kế toán có mã ngành là: 7340301
Mã ngành của Ngành Công nghệ thông tin Hệ chất lượng cao là bao nhiêu?,Ngành Công nghệ thông tin Hệ chất lượng cao có mã ngành là: 7480201(CLC)
Mã ngành của Ngành Công nghệ thông tin Hệ chất lượng cao là bao nhiêu?,Ngành Công nghệ thông tin Hệ chất lượng cao có mã ngành là: 7480201(CLC)
Mã ngành của Ngành Công nghệ thông tin Hệ chất lượng cao là bao nhiêu?,Ngành Công nghệ thông tin Hệ chất lượng cao có mã ngành là: 7480201(CLC)
Mã ngành của Ngành Kỹ thuật Điều khiển và Tự động hóa là bao nhiêu?,Ngành Kỹ thuật Điều khiển và Tự động hóa có mã ngành là: 7520216
Mã ngành của Ngành Báo chí (Journalism) là bao nhiêu?,Ngành Báo chí (Journalism) có mã ngành là: 7320101
Mã ngành của Ngành Công nghệ tài chính - Fintech là bao nhiêu?,Ngành Công nghệ tài chính - Fintech có mã ngành là: 7340205
Mã ngành của Chương trình Kỹ thuật dữ liệu (ngành Mạng máy tính và truyền thông dữ liệu) là bao nhiêu?,Chương trình Kỹ thuật dữ liệu (ngành Mạng máy tính và truyền thông dữ liệu) có mã ngành là: 7480102
Mã ngành của Ngành Marketing hệ chất lượng cao là bao nhiêu?,Ngành Marketing hệ chất lượng cao có mã ngành là: 7340115_CLC
Mã ngành của Ngành Công nghệ Internet vạn vật (IoT) là bao nhiêu?,Ngành Công nghệ Internet vạn vật (IoT) có mã ngành là: 7520208
Mã ngành của Ngành Kế toán - Chất lượng cao chuẩn quốc tế - ACCA là bao nhiêu?,Ngành Kế toán - Chất lượng cao chuẩn quốc tế - ACCA có mã ngành là: 734030
Mã ngành của Chương trình Thiết kế và Phát triển Game là bao nhiêu?,Chương trình Thiết kế và Phát triển Game có mã ngành là: 7329001_GAM
Mã ngành của Chương trình Công nghệ thông tin Việt - Nhật là bao nhiêu?,Chương trình Công nghệ thông tin Việt - Nhật có mã ngành là: 7480201_VNH
Thời gian học của Chương trình Công nghệ thông tin (định hướng ứng dụng) là bao lâu?,Chương trình Công nghệ thông tin (định hướng ứng dụng) có thời gian học là: 4 năm
Thời gian học của Ngành Khoa học máy tính là bao lâu?,"Ngành Khoa học máy tính có thời gian học là: 4,5 năm"
Thời gian học của Ngành Công nghệ thông tin là bao lâu?,"Ngành Công nghệ thông tin có thời gian học là: 4,5 năm"
Thời gian học của Ngành An toàn thông tin là bao lâu?,Ngành An toàn thông tin có thời gian học là: 4.5 năm
Thời gian học của Ngành Kỹ thuật Điện tử viễn thông là bao lâu?,"Ngành Kỹ thuật Điện tử viễn thông có thời gian học là: 4,5 năm"
"Thời gian học của Ngành Công nghệ kỹ thuật Điện, điện tử là bao lâu?","Ngành Công nghệ kỹ thuật Điện, điện tử có thời gian học là: 4.5 năm"
Thời gian học của Ngành Công nghệ đa phương tiện là bao lâu?,"Ngành Công nghệ đa phương tiện có thời gian học là: 4,5 năm"
Thời gian học của Ngành Truyền thông đa phương tiện là bao lâu?,Ngành Truyền thông đa phương tiện có thời gian học là: 4 năm
Thời gian học của Ngành Marketing là bao lâu?,Ngành Marketing có thời gian học là: 4 năm
Thời gian học của Ngành Thương mại điện tử là bao lâu?,Ngành Thương mại điện tử có thời gian học là: 4 năm
Thời gian học của Ngành Quản trị kinh doanh là bao lâu?,Ngành Quản trị kinh doanh có thời gian học là: 4 năm
Thời gian học của Ngành Kế toán là bao lâu?,Ngành Kế toán có thời gian học là: 4 năm
Thời gian học của Ngành Kế toán là bao lâu?,Ngành Kế toán có thời gian học là: 4 năm
Thời gian học của Ngành Công nghệ thông tin Hệ chất lượng cao là bao lâu?,Ngành Công nghệ thông tin Hệ chất lượng cao có thời gian học là: 4.5 năm
Thời gian học của Ngành Công nghệ thông tin Hệ chất lượng cao là bao lâu?,Ngành Công nghệ thông tin Hệ chất lượng cao có thời gian học là: 4.5 năm
Thời gian học của Ngành Công nghệ thông tin Hệ chất lượng cao là bao lâu?,Ngành Công nghệ thông tin Hệ chất lượng cao có thời gian học là: 4.5 năm
Thời gian học của Ngành Kỹ thuật Điều khiển và Tự động hóa là bao lâu?,Ngành Kỹ thuật Điều khiển và Tự động hóa có thời gian học là: 4.5 năm
Thời gian học của Ngành Báo chí (Journalism) là bao lâu?,Ngành Báo chí (Journalism) có thời gian học là: 4 năm
Thời gian học của Ngành Công nghệ tài chính - Fintech là bao lâu?,Ngành Công nghệ tài chính - Fintech có thời gian học là: 4 năm
Thời gian học của Chương trình Kỹ thuật dữ liệu (ngành Mạng máy tính và truyền thông dữ liệu) là bao lâu?,"Chương trình Kỹ thuật dữ liệu (ngành Mạng máy tính và truyền thông dữ liệu) có thời gian học là: 4,5 năm"
Thời gian học của Ngành Marketing hệ chất lượng cao là bao lâu?,Ngành Marketing hệ chất lượng cao có thời gian học là: 4 năm
Thời gian học của Ngành Công nghệ Internet vạn vật (IoT) là bao lâu?,Ngành Công nghệ Internet vạn vật (IoT) có thời gian học là: 4.5 năm
Thời gian học của Ngành Kế toán - Chất lượng cao chuẩn quốc tế - ACCA là bao lâu?,Ngành Kế toán - Chất lượng cao chuẩn quốc tế - ACCA có thời gian học là: 4 năm
Thời gian học của Chương trình Thiết kế và Phát triển Game là bao lâu?,Chương trình Thiết kế và Phát triển Game có thời gian học là: 4 năm
Thời gian học của Chương trình Công nghệ thông tin Việt - Nhật là bao lâu?,"Chương trình Công nghệ thông tin Việt - Nhật có thời gian học là: 4,5 năm"
Thời gian nào Chương trình Công nghệ thông tin (định hướng ứng dụng) bắt đầu nhập học?,Chương trình Công nghệ thông tin (định hướng ứng dụng) có thời gian nhập học bắt đầu từ: Mùa thu
Thời gian nào Ngành Khoa học máy tính bắt đầu nhập học?,Ngành Khoa học máy tính có thời gian nhập học bắt đầu từ: Mùa thu
Thời gian nào Ngành Công nghệ thông tin bắt đầu nhập học?,Ngành Công nghệ thông tin có thời gian nhập học bắt đầu từ: Mùa thu
Thời gian nào Ngành An toàn thông tin bắt đầu nhập học?,Ngành An toàn thông tin có thời gian nhập học bắt đầu từ: Mùa thu
Thời gian nào Ngành Kỹ thuật Điện tử viễn thông bắt đầu nhập học?,Ngành Kỹ thuật Điện tử viễn thông có thời gian nhập học bắt đầu từ: Mùa thu
"Thời gian nào Ngành Công nghệ kỹ thuật Điện, điện tử bắt đầu nhập học?","Ngành Công nghệ kỹ thuật Điện, điện tử có thời gian nhập học bắt đầu từ: Mùa thu"
Thời gian nào Ngành Công nghệ đa phương tiện bắt đầu nhập học?,Ngành Công nghệ đa phương tiện có thời gian nhập học bắt đầu từ: Mùa thu
Thời gian nào Ngành Truyền thông đa phương tiện bắt đầu nhập học?,Ngành Truyền thông đa phương tiện có thời gian nhập học bắt đầu từ: Mùa thu
Thời gian nào Ngành Marketing bắt đầu nhập học?,Ngành Marketing có thời gian nhập học bắt đầu từ: Mùa thu
Thời gian nào Ngành Thương mại điện tử bắt đầu nhập học?,Ngành Thương mại điện tử có thời gian nhập học bắt đầu từ: Mùa thu
Thời gian nào Ngành Quản trị kinh doanh bắt đầu nhập học?,Ngành Quản trị kinh doanh có thời gian nhập học bắt đầu từ: Mùa thu
Thời gian nào Ngành Kế toán bắt đầu nhập học?,Ngành Kế toán có thời gian nhập học bắt đầu từ: Mùa thu
Thời gian nào Ngành Kế toán bắt đầu nhập học?,Ngành Kế toán có thời gian nhập học bắt đầu từ: Mùa thu
Thời gian nào Ngành Công nghệ thông tin Hệ chất lượng cao bắt đầu nhập học?,Ngành Công nghệ thông tin Hệ chất lượng cao có thời gian nhập học bắt đầu từ: Mùa thu
Thời gian nào Ngành Công nghệ thông tin Hệ chất lượng cao bắt đầu nhập học?,Ngành Công nghệ thông tin Hệ chất lượng cao có thời gian nhập học bắt đầu từ: Mùa thu
Thời gian nào Ngành Công nghệ thông tin Hệ chất lượng cao bắt đầu nhập học?,Ngành Công nghệ thông tin Hệ chất lượng cao có thời gian nhập học bắt đầu từ: Mùa thu
Thời gian nào Ngành Kỹ thuật Điều khiển và Tự động hóa bắt đầu nhập học?,Ngành Kỹ thuật Điều khiển và Tự động hóa có thời gian nhập học bắt đầu từ: Mùa thu
Thời gian nào Ngành Báo chí (Journalism) bắt đầu nhập học?,Ngành Báo chí (Journalism) có thời gian nhập học bắt đầu từ: Mùa thu
Thời gian nào Ngành Công nghệ tài chính - Fintech bắt đầu nhập học?,Ngành Công nghệ tài chính - Fintech có thời gian nhập học bắt đầu từ: Mùa thu
Thời gian nào Chương trình Kỹ thuật dữ liệu (ngành Mạng máy tính và truyền thông dữ liệu) bắt đầu nhập học?,Chương trình Kỹ thuật dữ liệu (ngành Mạng máy tính và truyền thông dữ liệu) có thời gian nhập học bắt đầu từ: Mùa thu
Thời gian nào Ngành Marketing hệ chất lượng cao bắt đầu nhập học?,Ngành Marketing hệ chất lượng cao có thời gian nhập học bắt đầu từ: Mùa thu
Thời gian nào Ngành Công nghệ Internet vạn vật (IoT) bắt đầu nhập học?,Ngành Công nghệ Internet vạn vật (IoT) có thời gian nhập học bắt đầu từ: Mùa thu
Thời gian nào Ngành Kế toán - Chất lượng cao chuẩn quốc tế - ACCA bắt đầu nhập học?,Ngành Kế toán - Chất lượng cao chuẩn quốc tế - ACCA có thời gian nhập học bắt đầu từ: Mùa thu
Thời gian nào Chương trình Thiết kế và Phát triển Game bắt đầu nhập học?,Chương trình Thiết kế và Phát triển Game có thời gian nhập học bắt đầu từ: Mùa thu
Thời gian nào Chương trình Công nghệ thông tin Việt - Nhật bắt đầu nhập học?,Chương trình Công nghệ thông tin Việt - Nhật có thời gian nhập học bắt đầu từ: Mùa thu
Chương trình Công nghệ thông tin (định hướng ứng dụng) được đào tạo ở cơ sở nào?,Chương trình Công nghệ thông tin (định hướng ứng dụng) được đào tạo ở cơ sở Hà Nội
Chương trình Công nghệ thông tin (định hướng ứng dụng) được đào tạo ở cơ sở miền bắc không?,Chương trình Công nghệ thông tin (định hướng ứng dụng) được đào tạo ở cơ sở Hà Nội
Chương trình Công nghệ thông tin (định hướng ứng dụng) được đào tạo ở cơ sở miền nam không?,Chương trình Công nghệ thông tin (định hướng ứng dụng) được đào tạo ở cơ sở Hà Nội
Ngành Khoa học máy tính được đào tạo ở cơ sở nào?,Ngành Khoa học máy tính được đào tạo ở cơ sở Hà Nội
Ngành Khoa học máy tính được đào tạo ở cơ sở miền bắc không?,Ngành Khoa học máy tính được đào tạo ở cơ sở Hà Nội
Ngành Khoa học máy tính được đào tạo ở cơ sở miền nam không?,Ngành Khoa học máy tính được đào tạo ở cơ sở Hà Nội
Ngành Công nghệ thông tin được đào tạo ở cơ sở nào?,Ngành Công nghệ thông tin được đào tạo ở cơ sở Hà Nội và Tp Hồ Chí Minh
Ngành Công nghệ thông tin được đào tạo ở cơ sở miền bắc không?,Ngành Công nghệ thông tin được đào tạo ở cơ sở Hà Nội và Tp Hồ Chí Minh
Ngành Công nghệ thông tin được đào tạo ở cơ sở miền nam không?,Ngành Công nghệ thông tin được đào tạo ở cơ sở Hà Nội và Tp Hồ Chí Minh
Ngành An toàn thông tin được đào tạo ở cơ sở nào?,Ngành An toàn thông tin được đào tạo ở cơ sở Hà Nội và Tp Hồ Chí Minh
Ngành An toàn thông tin được đào tạo ở cơ sở miền bắc không?,Ngành An toàn thông tin được đào tạo ở cơ sở Hà Nội và Tp Hồ Chí Minh
Ngành An toàn thông tin được đào tạo ở cơ sở miền nam không?,Ngành An toàn thông tin được đào tạo ở cơ sở Hà Nội và Tp Hồ Chí Minh
Ngành Kỹ thuật Điện tử viễn thông được đào tạo ở cơ sở nào?,Ngành Kỹ thuật Điện tử viễn thông được đào tạo ở cơ sở Hà Nội và Tp Hồ Chí Minh
Ngành Kỹ thuật Điện tử viễn thông được đào tạo ở cơ sở miền bắc không?,Ngành Kỹ thuật Điện tử viễn thông được đào tạo ở cơ sở Hà Nội và Tp Hồ Chí Minh
Ngành Kỹ thuật Điện tử viễn thông được đào tạo ở cơ sở miền nam không?,Ngành Kỹ thuật Điện tử viễn thông được đào tạo ở cơ sở Hà Nội và Tp Hồ Chí Minh
"Ngành Công nghệ kỹ thuật Điện, điện tử được đào tạo ở cơ sở nào?","Ngành Công nghệ kỹ thuật Điện, điện tử được đào tạo ở cơ sở Hà Nội và Tp Hồ Chí Minh"
"Ngành Công nghệ kỹ thuật Điện, điện tử được đào tạo ở cơ sở miền bắc không?","Ngành Công nghệ kỹ thuật Điện, điện tử được đào tạo ở cơ sở Hà Nội và Tp Hồ Chí Minh"
"Ngành Công nghệ kỹ thuật Điện, điện tử được đào tạo ở cơ sở miền nam không?","Ngành Công nghệ kỹ thuật Điện, điện tử được đào tạo ở cơ sở Hà Nội và Tp Hồ Chí Minh"
Ngành Công nghệ đa phương tiện được đào tạo ở cơ sở nào?,Ngành Công nghệ đa phương tiện được đào tạo ở cơ sở Hà Nội và Tp Hồ Chí Minh
Ngành Công nghệ đa phương tiện được đào tạo ở cơ sở miền bắc không?,Ngành Công nghệ đa phương tiện được đào tạo ở cơ sở Hà Nội và Tp Hồ Chí Minh
Ngành Công nghệ đa phương tiện được đào tạo ở cơ sở miền nam không?,Ngành Công nghệ đa phương tiện được đào tạo ở cơ sở Hà Nội và Tp Hồ Chí Minh
Ngành Truyền thông đa phương tiện được đào tạo ở cơ sở nào?,Ngành Truyền thông đa phương tiện được đào tạo ở cơ sở Hà Nội và Tp Hồ Chí Minh
Ngành Truyền thông đa phương tiện được đào tạo ở cơ sở miền bắc không?,Ngành Truyền thông đa phương tiện được đào tạo ở cơ sở Hà Nội và Tp Hồ Chí Minh
Ngành Truyền thông đa phương tiện được đào tạo ở cơ sở miền nam không?,Ngành Truyền thông đa phương tiện được đào tạo ở cơ sở Hà Nội và Tp Hồ Chí Minh
Ngành Marketing được đào tạo ở cơ sở nào?,Ngành Marketing được đào tạo ở cơ sở Hà Nội và Tp Hồ Chí Minh
Ngành Marketing được đào tạo ở cơ sở miền bắc không?,Ngành Marketing được đào tạo ở cơ sở Hà Nội và Tp Hồ Chí Minh
