question,answer
Thời gian đào tạo của Ngành Thương mại điện tử là bao lâu?,Ngành Thương mại điện tử có thời gian học là: 4 năm
Ngành Thương mại điện tử học bao lâu?,Ngành Thương mại điện tử có thời gian học là: 4 năm
Số năm đào tạo của Ngành Thương mại điện tử là bao lâu?,Ngành Thương mại điện tử có thời gian học là: 4 năm
Số năm học của Ngành Thương mại điện tử là bao lâu?,Ngành Thương mại điện tử có thời gian học là: 4 năm
Thời gian học của Ngành Quản trị kinh doanh là bao lâu?,Ngành Quản trị kinh doanh có thời gian học là: 4 năm
Thời gian đào tạo của Ngành Quản trị kinh doanh là bao lâu?,Ngành Quản trị kinh doanh có thời gian học là: 4 năm
Ngành Quản trị kinh doanh học bao lâu?,Ngành Quản trị kinh doanh có thời gian học là: 4 năm
Số năm đào tạo của Ngành Quản trị kinh doanh là bao lâu?,Ngành Quản trị kinh doanh có thời gian học là: 4 năm
Số năm học của Ngành Quản trị kinh doanh là bao lâu?,Ngành Quản trị kinh doanh có thời gian học là: 4 năm
Thời gian học của Ngành Kế toán là bao lâu?,Ngành Kế toán có thời gian học là: 4 năm
Thời gian đào tạo của Ngành Kế toán là bao lâu?,Ngành Kế toán có thời gian học là: 4 năm
Ngành Kế toán học bao lâu?,Ngành Kế toán có thời gian học là: 4 năm
Số năm đào tạo của Ngành Kế toán là bao lâu?,Ngành Kế toán có thời gian học là: 4 năm
Số năm học của Ngành Kế toán là bao lâu?,Ngành Kế toán có thời gian học là: 4 năm
Thời gian học của Ngành Công nghệ thông tin chương trình chất lượng cao là bao lâu?,Ngành Công nghệ thông tin chương trình chất lượng cao có thời gian học là: 4.5 năm
Thời gian đào tạo của Ngành Công nghệ thông tin chương trình chất lượng cao là bao lâu?,Ngành Công nghệ thông tin chương trình chất lượng cao có thời gian học là: 4.5 năm
Ngành Công nghệ thông tin chương trình chất lượng cao học bao lâu?,Ngành Công nghệ thông tin chương trình chất lượng cao có thời gian học là: 4.5 năm
Số năm đào tạo của Ngành Công nghệ thông tin chương trình chất lượng cao là bao lâu?,Ngành Công nghệ thông tin chương trình chất lượng cao có thời gian học là: 4.5 năm
Số năm học của Ngành Công nghệ thông tin chương trình chất lượng cao là bao lâu?,Ngành Công nghệ thông tin chương trình chất lượng cao có thời gian học là: 4.5 năm
Thời gian học của Ngành Kỹ thuật Điều khiển và Tự động hóa là bao lâu?,Ngành Kỹ thuật Điều khiển và Tự động hóa có thời gian học là: 4.5 năm
Thời gian đào tạo của Ngành Kỹ thuật Điều khiển và Tự động hóa là bao lâu?,Ngành Kỹ thuật Điều khiển và Tự động hóa có thời gian học là: 4.5 năm
Ngành Kỹ thuật Điều khiển và Tự động hóa học bao lâu?,Ngành Kỹ thuật Điều khiển và Tự động hóa có thời gian học là: 4.5 năm
Số năm đào tạo của Ngành Kỹ thuật Điều khiển và Tự động hóa là bao lâu?,Ngành Kỹ thuật Điều khiển và Tự động hóa có thời gian học là: 4.5 năm
Số năm học của Ngành Kỹ thuật Điều khiển và Tự động hóa là bao lâu?,Ngành Kỹ thuật Điều khiển và Tự động hóa có thời gian học là: 4.5 năm
Thời gian học của Ngành Báo chí (Journalism) là bao lâu?,Ngành Báo chí (Journalism) có thời gian học là: 4 năm
Thời gian đào tạo của Ngành Báo chí (Journalism) là bao lâu?,Ngành Báo chí (Journalism) có thời gian học là: 4 năm
Ngành Báo chí (Journalism) học bao lâu?,Ngành Báo chí (Journalism) có thời gian học là: 4 năm
Số năm đào tạo của Ngành Báo chí (Journalism) là bao lâu?,Ngành Báo chí (Journalism) có thời gian học là: 4 năm
Số năm học của Ngành Báo chí (Journalism) là bao lâu?,Ngành Báo chí (Journalism) có thời gian học là: 4 năm
Thời gian học của Ngành Công nghệ tài chính - Fintech là bao lâu?,Ngành Công nghệ tài chính - Fintech có thời gian học là: 4 năm
Thời gian đào tạo của Ngành Công nghệ tài chính - Fintech là bao lâu?,Ngành Công nghệ tài chính - Fintech có thời gian học là: 4 năm
Ngành Công nghệ tài chính - Fintech học bao lâu?,Ngành Công nghệ tài chính - Fintech có thời gian học là: 4 năm
Số năm đào tạo của Ngành Công nghệ tài chính - Fintech là bao lâu?,Ngành Công nghệ tài chính - Fintech có thời gian học là: 4 năm
Số năm học của Ngành Công nghệ tài chính - Fintech là bao lâu?,Ngành Công nghệ tài chính - Fintech có thời gian học là: 4 năm
Thời gian học của Chương trình Kỹ thuật dữ liệu (ngành Mạng máy tính và truyền thông dữ liệu) là bao lâu?,"Chương trình Kỹ thuật dữ liệu (ngành Mạng máy tính và truyền thông dữ liệu) có thời gian học là: 4,5 năm"
Thời gian đào tạo của Chương trình Kỹ thuật dữ liệu (ngành Mạng máy tính và truyền thông dữ liệu) là bao lâu?,"Chương trình Kỹ thuật dữ liệu (ngành Mạng máy tính và truyền thông dữ liệu) có thời gian học là: 4,5 năm"
Chương trình Kỹ thuật dữ liệu (ngành Mạng máy tính và truyền thông dữ liệu) học bao lâu?,"Chương trình Kỹ thuật dữ liệu (ngành Mạng máy tính và truyền thông dữ liệu) có thời gian học là: 4,5 năm"
Số năm đào tạo của Chương trình Kỹ thuật dữ liệu (ngành Mạng máy tính và truyền thông dữ liệu) là bao lâu?,"Chương trình Kỹ thuật dữ liệu (ngành Mạng máy tính và truyền thông dữ liệu) có thời gian học là: 4,5 năm"
Số năm học của Chương trình Kỹ thuật dữ liệu (ngành Mạng máy tính và truyền thông dữ liệu) là bao lâu?,"Chương trình Kỹ thuật dữ liệu (ngành Mạng máy tính và truyền thông dữ liệu) có thời gian học là: 4,5 năm"
Thời gian học của Ngành Marketing chương trình chất lượng cao là bao lâu?,Ngành Marketing chương trình chất lượng cao có thời gian học là: 4 năm
Thời gian đào tạo của Ngành Marketing chương trình chất lượng cao là bao lâu?,Ngành Marketing chương trình chất lượng cao có thời gian học là: 4 năm
Ngành Marketing chương trình chất lượng cao học bao lâu?,Ngành Marketing chương trình chất lượng cao có thời gian học là: 4 năm
Số năm đào tạo của Ngành Marketing chương trình chất lượng cao là bao lâu?,Ngành Marketing chương trình chất lượng cao có thời gian học là: 4 năm
Số năm học của Ngành Marketing chương trình chất lượng cao là bao lâu?,Ngành Marketing chương trình chất lượng cao có thời gian học là: 4 năm
Thời gian học của Ngành Công nghệ Internet vạn vật (IoT) là bao lâu?,Ngành Công nghệ Internet vạn vật (IoT) có thời gian học là: 4.5 năm
Thời gian đào tạo của Ngành Công nghệ Internet vạn vật (IoT) là bao lâu?,Ngành Công nghệ Internet vạn vật (IoT) có thời gian học là: 4.5 năm
Ngành Công nghệ Internet vạn vật (IoT) học bao lâu?,Ngành Công nghệ Internet vạn vật (IoT) có thời gian học là: 4.5 năm
Số năm đào tạo của Ngành Công nghệ Internet vạn vật (IoT) là bao lâu?,Ngành Công nghệ Internet vạn vật (IoT) có thời gian học là: 4.5 năm
Số năm học của Ngành Công nghệ Internet vạn vật (IoT) là bao lâu?,Ngành Công nghệ Internet vạn vật (IoT) có thời gian học là: 4.5 năm
Thời gian học của Ngành Kế toán - chương trình Chất lượng cao là bao lâu?,Ngành Kế toán - chương trình Chất lượng cao có thời gian học là: 4 năm
Thời gian đào tạo của Ngành Kế toán - chương trình Chất lượng cao là bao lâu?,Ngành Kế toán - chương trình Chất lượng cao có thời gian học là: 4 năm
Ngành Kế toán - chương trình Chất lượng cao học bao lâu?,Ngành Kế toán - chương trình Chất lượng cao có thời gian học là: 4 năm
Số năm đào tạo của Ngành Kế toán - chương trình Chất lượng cao là bao lâu?,Ngành Kế toán - chương trình Chất lượng cao có thời gian học là: 4 năm
Số năm học của Ngành Kế toán - chương trình Chất lượng cao là bao lâu?,Ngành Kế toán - chương trình Chất lượng cao có thời gian học là: 4 năm
Thời gian học của Chương trình Thiết kế và Phát triển Game là bao lâu?,Chương trình Thiết kế và Phát triển Game có thời gian học là: 4 năm
Thời gian đào tạo của Chương trình Thiết kế và Phát triển Game là bao lâu?,Chương trình Thiết kế và Phát triển Game có thời gian học là: 4 năm
Chương trình Thiết kế và Phát triển Game học bao lâu?,Chương trình Thiết kế và Phát triển Game có thời gian học là: 4 năm
Số năm đào tạo của Chương trình Thiết kế và Phát triển Game là bao lâu?,Chương trình Thiết kế và Phát triển Game có thời gian học là: 4 năm
Số năm học của Chương trình Thiết kế và Phát triển Game là bao lâu?,Chương trình Thiết kế và Phát triển Game có thời gian học là: 4 năm
Thời gian học của Chương trình Công nghệ thông tin Việt - Nhật là bao lâu?,"Chương trình Công nghệ thông tin Việt - Nhật có thời gian học là: 4,5 năm"
Thời gian đào tạo của Chương trình Công nghệ thông tin Việt - Nhật là bao lâu?,"Chương trình Công nghệ thông tin Việt - Nhật có thời gian học là: 4,5 năm"
Chương trình Công nghệ thông tin Việt - Nhật học bao lâu?,"Chương trình Công nghệ thông tin Việt - Nhật có thời gian học là: 4,5 năm"
Số năm đào tạo của Chương trình Công nghệ thông tin Việt - Nhật là bao lâu?,"Chương trình Công nghệ thông tin Việt - Nhật có thời gian học là: 4,5 năm"
Số năm học của Chương trình Công nghệ thông tin Việt - Nhật là bao lâu?,"Chương trình Công nghệ thông tin Việt - Nhật có thời gian học là: 4,5 năm"
Thời gian nào Chương trình Công nghệ thông tin (định hướng ứng dụng) bắt đầu nhập học?,Chương trình Công nghệ thông tin (định hướng ứng dụng) có thời gian nhập học bắt đầu từ: Mùa thu
Thời gian nào Ngành Khoa học máy tính bắt đầu nhập học?,Ngành Khoa học máy tính có thời gian nhập học bắt đầu từ: Mùa thu
Thời gian nào Ngành Công nghệ thông tin bắt đầu nhập học?,Ngành Công nghệ thông tin có thời gian nhập học bắt đầu từ: Mùa thu
Thời gian nào Ngành An toàn thông tin bắt đầu nhập học?,Ngành An toàn thông tin có thời gian nhập học bắt đầu từ: Mùa thu
Thời gian nào Ngành Kỹ thuật Điện tử viễn thông bắt đầu nhập học?,Ngành Kỹ thuật Điện tử viễn thông có thời gian nhập học bắt đầu từ: Mùa thu
"Thời gian nào Ngành Công nghệ kỹ thuật Điện, điện tử bắt đầu nhập học?","Ngành Công nghệ kỹ thuật Điện, điện tử có thời gian nhập học bắt đầu từ: Mùa thu"
Thời gian nào Ngành Công nghệ đa phương tiện bắt đầu nhập học?,Ngành Công nghệ đa phương tiện có thời gian nhập học bắt đầu từ: Mùa thu
Thời gian nào Ngành Truyền thông đa phương tiện bắt đầu nhập học?,Ngành Truyền thông đa phương tiện có thời gian nhập học bắt đầu từ: Mùa thu
Thời gian nào Ngành Marketing bắt đầu nhập học?,Ngành Marketing có thời gian nhập học bắt đầu từ: Mùa thu
Thời gian nào Ngành Thương mại điện tử bắt đầu nhập học?,Ngành Thương mại điện tử có thời gian nhập học bắt đầu từ: Mùa thu
Thời gian nào Ngành Quản trị kinh doanh bắt đầu nhập học?,Ngành Quản trị kinh doanh có thời gian nhập học bắt đầu từ: Mùa thu
Thời gian nào Ngành Kế toán bắt đầu nhập học?,Ngành Kế toán có thời gian nhập học bắt đầu từ: Mùa thu
Thời gian nào Ngành Công nghệ thông tin chương trình chất lượng cao bắt đầu nhập học?,Ngành Công nghệ thông tin chương trình chất lượng cao có thời gian nhập học bắt đầu từ: Mùa thu
Thời gian nào Ngành Kỹ thuật Điều khiển và Tự động hóa bắt đầu nhập học?,Ngành Kỹ thuật Điều khiển và Tự động hóa có thời gian nhập học bắt đầu từ: Mùa thu
Thời gian nào Ngành Báo chí (Journalism) bắt đầu nhập học?,Ngành Báo chí (Journalism) có thời gian nhập học bắt đầu từ: Mùa thu
Thời gian nào Ngành Công nghệ tài chính - Fintech bắt đầu nhập học?,Ngành Công nghệ tài chính - Fintech có thời gian nhập học bắt đầu từ: Mùa thu
Thời gian nào Chương trình Kỹ thuật dữ liệu (ngành Mạng máy tính và truyền thông dữ liệu) bắt đầu nhập học?,Chương trình Kỹ thuật dữ liệu (ngành Mạng máy tính và truyền thông dữ liệu) có thời gian nhập học bắt đầu từ: Mùa thu
Thời gian nào Ngành Marketing chương trình chất lượng cao bắt đầu nhập học?,Ngành Marketing chương trình chất lượng cao có thời gian nhập học bắt đầu từ: Mùa thu
Thời gian nào Ngành Công nghệ Internet vạn vật (IoT) bắt đầu nhập học?,Ngành Công nghệ Internet vạn vật (IoT) có thời gian nhập học bắt đầu từ: Mùa thu
Thời gian nào Ngành Kế toán - chương trình Chất lượng cao bắt đầu nhập học?,Ngành Kế toán - chương trình Chất lượng cao có thời gian nhập học bắt đầu từ: Mùa thu
Thời gian nào Chương trình Thiết kế và Phát triển Game bắt đầu nhập học?,Chương trình Thiết kế và Phát triển Game có thời gian nhập học bắt đầu từ: Mùa thu
Thời gian nào Chương trình Công nghệ thông tin Việt - Nhật bắt đầu nhập học?,Chương trình Công nghệ thông tin Việt - Nhật có thời gian nhập học bắt đầu từ: Mùa thu
Chương trình Công nghệ thông tin (định hướng ứng dụng) được đào tạo ở cơ sở nào?,Chương trình Công nghệ thông tin (định hướng ứng dụng) được đào tạo ở cơ sở Hà Nội
Chương trình Công nghệ thông tin (định hướng ứng dụng) được đào tạo ở cơ sở miền bắc không?,Chương trình Công nghệ thông tin (định hướng ứng dụng) được đào tạo ở cơ sở Hà Nội
Chương trình Công nghệ thông tin (định hướng ứng dụng) được đào tạo ở cơ sở miền nam không?,Chương trình Công nghệ thông tin (định hướng ứng dụng) được đào tạo ở cơ sở Hà Nội
Ngành Khoa học máy tính được đào tạo ở cơ sở nào?,Ngành Khoa học máy tính được đào tạo ở cơ sở Hà Nội
Ngành Khoa học máy tính được đào tạo ở cơ sở miền bắc không?,Ngành Khoa học máy tính được đào tạo ở cơ sở Hà Nội
Ngành Khoa học máy tính được đào tạo ở cơ sở miền nam không?,Ngành Khoa học máy tính được đào tạo ở cơ sở Hà Nội
Ngành Công nghệ thông tin được đào tạo ở cơ sở nào?,Ngành Công nghệ thông tin được đào tạo ở cơ sở Hà Nội và Tp Hồ Chí Minh
Ngành Công nghệ thông tin được đào tạo ở cơ sở miền bắc không?,Ngành Công nghệ thông tin được đào tạo ở cơ sở Hà Nội và Tp Hồ Chí Minh
Ngành Công nghệ thông tin được đào tạo ở cơ sở miền nam không?,Ngành Công nghệ thông tin được đào tạo ở cơ sở Hà Nội và Tp Hồ Chí Minh
Ngành An toàn thông tin được đào tạo ở cơ sở nào?,Ngành An toàn thông tin được đào tạo ở cơ sở Hà Nội và Tp Hồ Chí Minh
Ngành An toàn thông tin được đào tạo ở cơ sở miền bắc không?,Ngành An toàn thông tin được đào tạo ở cơ sở Hà Nội và Tp Hồ Chí Minh
Ngành An toàn thông tin được đào tạo ở cơ sở miền nam không?,Ngành An toàn thông tin được đào tạo ở cơ sở Hà Nội và Tp Hồ Chí Minh
Ngành Kỹ thuật Điện tử viễn thông được đào tạo ở cơ sở nào?,Ngành Kỹ thuật Điện tử viễn thông được đào tạo ở cơ sở Hà Nội và Tp Hồ Chí Minh
Ngành Kỹ thuật Điện tử viễn thông được đào tạo ở cơ sở miền bắc không?,Ngành Kỹ thuật Điện tử viễn thông được đào tạo ở cơ sở Hà Nội và Tp Hồ Chí Minh
Ngành Kỹ thuật Điện tử viễn thông được đào tạo ở cơ sở miền nam không?,Ngành Kỹ thuật Điện tử viễn thông được đào tạo ở cơ sở Hà Nội và Tp Hồ Chí Minh
"Ngành Công nghệ kỹ thuật Điện, điện tử được đào tạo ở cơ sở nào?","Ngành Công nghệ kỹ thuật Điện, điện tử được đào tạo ở cơ sở Hà Nội và Tp Hồ Chí Minh"
"Ngành Công nghệ kỹ thuật Điện, điện tử được đào tạo ở cơ sở miền bắc không?","Ngành Công nghệ kỹ thuật Điện, điện tử được đào tạo ở cơ sở Hà Nội và Tp Hồ Chí Minh"
"Ngành Công nghệ kỹ thuật Điện, điện tử được đào tạo ở cơ sở miền nam không?","Ngành Công nghệ kỹ thuật Điện, điện tử được đào tạo ở cơ sở Hà Nội và Tp Hồ Chí Minh"
Ngành Công nghệ đa phương tiện được đào tạo ở cơ sở nào?,Ngành Công nghệ đa phương tiện được đào tạo ở cơ sở Hà Nội và Tp Hồ Chí Minh
Ngành Công nghệ đa phương tiện được đào tạo ở cơ sở miền bắc không?,Ngành Công nghệ đa phương tiện được đào tạo ở cơ sở Hà Nội và Tp Hồ Chí Minh
Ngành Công nghệ đa phương tiện được đào tạo ở cơ sở miền nam không?,Ngành Công nghệ đa phương tiện được đào tạo ở cơ sở Hà Nội và Tp Hồ Chí Minh
Ngành Truyền thông đa phương tiện được đào tạo ở cơ sở nào?,Ngành Truyền thông đa phương tiện được đào tạo ở cơ sở Hà Nội và Tp Hồ Chí Minh
Ngành Truyền thông đa phương tiện được đào tạo ở cơ sở miền bắc không?,Ngành Truyền thông đa phương tiện được đào tạo ở cơ sở Hà Nội và Tp Hồ Chí Minh
Ngành Truyền thông đa phương tiện được đào tạo ở cơ sở miền nam không?,Ngành Truyền thông đa phương tiện được đào tạo ở cơ sở Hà Nội và Tp Hồ Chí Minh
Ngành Marketing được đào tạo ở cơ sở nào?,Ngành Marketing được đào tạo ở cơ sở Hà Nội và Tp Hồ Chí Minh
Ngành Marketing được đào tạo ở cơ sở miền bắc không?,Ngành Marketing được đào tạo ở cơ sở Hà Nội và Tp Hồ Chí Minh
Ngành Marketing được đào tạo ở cơ sở miền nam không?,Ngành Marketing được đào tạo ở cơ sở Hà Nội và Tp Hồ Chí Minh
Ngành Thương mại điện tử được đào tạo ở cơ sở nào?,Ngành Thương mại điện tử được đào tạo ở cơ sở Hà Nội và Tp Hồ Chí Minh
Ngành Thương mại điện tử được đào tạo ở cơ sở miền bắc không?,Ngành Thương mại điện tử được đào tạo ở cơ sở Hà Nội và Tp Hồ Chí Minh
Ngành Thương mại điện tử được đào tạo ở cơ sở miền nam không?,Ngành Thương mại điện tử được đào tạo ở cơ sở Hà Nội và Tp Hồ Chí Minh
Ngành Quản trị kinh doanh được đào tạo ở cơ sở nào?,Ngành Quản trị kinh doanh được đào tạo ở cơ sở Hà Nội và Tp Hồ Chí Minh
Ngành Quản trị kinh doanh được đào tạo ở cơ sở miền bắc không?,Ngành Quản trị kinh doanh được đào tạo ở cơ sở Hà Nội và Tp Hồ Chí Minh
Ngành Quản trị kinh doanh được đào tạo ở cơ sở miền nam không?,Ngành Quản trị kinh doanh được đào tạo ở cơ sở Hà Nội và Tp Hồ Chí Minh
Ngành Kế toán được đào tạo ở cơ sở nào?,Ngành Kế toán được đào tạo ở cơ sở Hà Nội và Tp Hồ Chí Minh
Ngành Kế toán được đào tạo ở cơ sở miền bắc không?,Ngành Kế toán được đào tạo ở cơ sở Hà Nội và Tp Hồ Chí Minh
Ngành Kế toán được đào tạo ở cơ sở miền nam không?,Ngành Kế toán được đào tạo ở cơ sở Hà Nội và Tp Hồ Chí Minh
Ngành Công nghệ thông tin chương trình chất lượng cao được đào tạo ở cơ sở nào?,Ngành Công nghệ thông tin chương trình chất lượng cao được đào tạo ở cơ sở Hà Nội và Tp Hồ Chí Minh
Ngành Công nghệ thông tin chương trình chất lượng cao được đào tạo ở cơ sở miền bắc không?,Ngành Công nghệ thông tin chương trình chất lượng cao được đào tạo ở cơ sở Hà Nội và Tp Hồ Chí Minh
Ngành Công nghệ thông tin chương trình chất lượng cao được đào tạo ở cơ sở miền nam không?,Ngành Công nghệ thông tin chương trình chất lượng cao được đào tạo ở cơ sở Hà Nội và Tp Hồ Chí Minh
Ngành Kỹ thuật Điều khiển và Tự động hóa được đào tạo ở cơ sở nào?,Ngành Kỹ thuật Điều khiển và Tự động hóa được đào tạo ở cơ sở Hà Nội và TP Hồ Chí Minh
Ngành Kỹ thuật Điều khiển và Tự động hóa được đào tạo ở cơ sở miền bắc không?,Ngành Kỹ thuật Điều khiển và Tự động hóa được đào tạo ở cơ sở Hà Nội và TP Hồ Chí Minh
Ngành Kỹ thuật Điều khiển và Tự động hóa được đào tạo ở cơ sở miền nam không?,Ngành Kỹ thuật Điều khiển và Tự động hóa được đào tạo ở cơ sở Hà Nội và TP Hồ Chí Minh
Ngành Báo chí (Journalism) được đào tạo ở cơ sở nào?,Ngành Báo chí (Journalism) được đào tạo ở cơ sở Hà Nội
Ngành Báo chí (Journalism) được đào tạo ở cơ sở miền bắc không?,Ngành Báo chí (Journalism) được đào tạo ở cơ sở Hà Nội
Ngành Báo chí (Journalism) được đào tạo ở cơ sở miền nam không?,Ngành Báo chí (Journalism) được đào tạo ở cơ sở Hà Nội
Ngành Công nghệ tài chính - Fintech được đào tạo ở cơ sở nào?,Ngành Công nghệ tài chính - Fintech được đào tạo ở cơ sở Hà Nội và Tp Hồ Chí Minh
Ngành Công nghệ tài chính - Fintech được đào tạo ở cơ sở miền bắc không?,Ngành Công nghệ tài chính - Fintech được đào tạo ở cơ sở Hà Nội và Tp Hồ Chí Minh
Ngành Công nghệ tài chính - Fintech được đào tạo ở cơ sở miền nam không?,Ngành Công nghệ tài chính - Fintech được đào tạo ở cơ sở Hà Nội và Tp Hồ Chí Minh
Chương trình Kỹ thuật dữ liệu (ngành Mạng máy tính và truyền thông dữ liệu) được đào tạo ở cơ sở nào?,Chương trình Kỹ thuật dữ liệu (ngành Mạng máy tính và truyền thông dữ liệu) được đào tạo ở cơ sở Hà Nội
Chương trình Kỹ thuật dữ liệu (ngành Mạng máy tính và truyền thông dữ liệu) được đào tạo ở cơ sở miền bắc không?,Chương trình Kỹ thuật dữ liệu (ngành Mạng máy tính và truyền thông dữ liệu) được đào tạo ở cơ sở Hà Nội
Chương trình Kỹ thuật dữ liệu (ngành Mạng máy tính và truyền thông dữ liệu) được đào tạo ở cơ sở miền nam không?,Chương trình Kỹ thuật dữ liệu (ngành Mạng máy tính và truyền thông dữ liệu) được đào tạo ở cơ sở Hà Nội
Ngành Marketing chương trình chất lượng cao được đào tạo ở cơ sở nào?,Ngành Marketing chương trình chất lượng cao được đào tạo ở cơ sở Hà Nội
Ngành Marketing chương trình chất lượng cao được đào tạo ở cơ sở miền bắc không?,Ngành Marketing chương trình chất lượng cao được đào tạo ở cơ sở Hà Nội
Ngành Marketing chương trình chất lượng cao được đào tạo ở cơ sở miền nam không?,Ngành Marketing chương trình chất lượng cao được đào tạo ở cơ sở Hà Nội
Ngành Công nghệ Internet vạn vật (IoT) được đào tạo ở cơ sở nào?,Ngành Công nghệ Internet vạn vật (IoT) được đào tạo ở cơ sở TP Hồ Chí Minh
